{
  "$schema": "https://json-schema.org/draft/2020-12/schema",
  "$id": "https://hy-home.k8s/contracts/validation-surfaces.schema.json",
  "title": "Affected-surface validation contract",
  "type": "object",
  "additionalProperties": false,
  "required": [
    "$schema",
    "schemaVersion",
    "pathSemantics",
    "lanes",
    "protectedLevels",
    "evidenceLanes",
    "validators",
    "surfaces",
    "profiles"
  ],
  "properties": {
    "$schema": {
      "const": "./registry.schema.json"
    },
    "schemaVersion": {
      "const": 4
    },
    "pathSemantics": {
      "type": "object",
      "additionalProperties": false,
      "required": [
        "separator",
        "matching",
        "caseSensitive",
        "precedence"
      ],
      "properties": {
        "separator": {
          "const": "posix"
        },
        "matching": {
          "const": "exact-or-anchored-regex"
        },
        "caseSensitive": {
          "const": true
        },
        "precedence": {
          "const": "none"
        }
      }
    },
    "lanes": {
      "type": "array",
      "minItems": 4,
      "uniqueItems": true,
      "items": {
        "enum": [
          "affected",
          "staged",
          "message/manual",
          "remote/live"
        ]
      }
    },
    "protectedLevels": {
      "const": [
        "none",
        "review",
        "protected"
      ]
    },
    "evidenceLanes": {
      "const": [
        "repo-static",
        "remote/live"
      ]
    },
    "validators": {
      "type": "array",
      "minItems": 1,
      "items": {
        "$ref": "#/$defs/validator"
      }
    },
    "surfaces": {
      "type": "array",
      "minItems": 1,
      "items": {
        "$ref": "#/$defs/surface"
      }
    },
    "profiles": {
      "type": "object",
      "additionalProperties": false,
      "required": [
        "quick",
        "staged"
      ],
      "properties": {
        "quick": {
          "type": "array",
          "minItems": 1,
          "uniqueItems": true,
          "items": {
            "$ref": "#/$defs/identifier"
          }
        },
        "staged": {
          "type": "array",
          "minItems": 1,
          "uniqueItems": true,
          "items": {
            "$ref": "#/$defs/identifier"
          }
        }
      }
    }
  },
  "$defs": {
    "identifier": {
      "type": "string",
      "pattern": "^[a-z][a-z0-9-]*$"
    },
    "route": {
      "type": "object",
      "additionalProperties": false,
      "required": [
        "kind",
        "value"
      ],
      "properties": {
        "kind": {
          "enum": [
            "exact",
            "regex"
          ]
        },
        "value": {
          "type": "string",
          "minLength": 1
        }
      }
    },
    "fallback": {
      "type": "object",
      "additionalProperties": false,
      "required": [
        "status",
        "reason"
      ],
      "properties": {
        "status": {
          "enum": [
            "FAIL",
            "DEFER",
            "NOT_APPLICABLE"
          ]
        },
        "reason": {
          "type": "string",
          "minLength": 1
        },
        "nextOwner": {
          "type": "string",
          "minLength": 1
        }
      }
    },
    "validator": {
      "type": "object",
      "additionalProperties": false,
      "required": [
        "id",
        "argv",
        "lanes",
        "optional",
        "fallback",
        "evidenceLane"
      ],
      "properties": {
        "id": {
          "$ref": "#/$defs/identifier"
        },
        "argv": {
          "type": "array",
          "minItems": 1,
          "items": {
            "type": "string",
            "minLength": 1
          }
        },
        "lanes": {
          "type": "array",
          "minItems": 1,
          "uniqueItems": true,
          "items": {
            "type": "string"
          }
        },
        "optional": {
          "type": "boolean"
        },
        "fallback": {
          "$ref": "#/$defs/fallback"
        },
        "evidenceLane": {
          "type": "string"
        },
        "structuredResults": {
          "const": "platform-depth-v2"
        },
        "pathInput": {
          "enum": [
            "include-existing-markdown",
            "include-existing-markdown-and-changed",
            "include-existing-files"
          ]
        },
        "globalSelection": {
          "const": "staged-changed"
        },
        "timeoutSeconds": {
          "type": "integer",
          "minimum": 1,
          "maximum": 7200
        },
        "reuse": {
          "type": "object",
          "additionalProperties": false,
          "required": [
            "mode"
          ],
          "properties": {
            "mode": {
              "enum": [
                "same-lane",
                "change-scoped"
              ]
            }
          }
        }
      }
    },
    "surface": {
      "type": "object",
      "additionalProperties": false,
      "required": [
        "id",
        "routes",
        "validators",
        "protectedLevel",
        "fallback",
        "evidenceLane"
      ],
      "properties": {
        "id": {
          "$ref": "#/$defs/identifier"
        },
        "routes": {
          "type": "array",
          "minItems": 1,
          "items": {
            "$ref": "#/$defs/route"
          }
        },
        "validators": {
          "type": "array",
          "minItems": 1,
          "uniqueItems": true,
          "items": {
            "$ref": "#/$defs/identifier"
          }
        },
        "protectedLevel": {
          "enum": [
            "none",
            "review",
            "protected"
          ]
        },
        "fallback": {
          "$ref": "#/$defs/fallback"
        },
        "evidenceLane": {
          "type": "string"
        }
      }
    }
  }
}
