{
  "$schema": "./registry.schema.json",
  "schemaVersion": 4,
  "pathSemantics": {
    "separator": "posix",
    "matching": "exact-or-anchored-regex",
    "caseSensitive": true,
    "precedence": "none"
  },
  "lanes": [
    "affected",
    "staged",
    "message/manual",
    "remote/live"
  ],
  "protectedLevels": [
    "none",
    "review",
    "protected"
  ],
  "evidenceLanes": [
    "repo-static",
    "remote/live"
  ],
  "validators": [
    {
      "id": "affected-surface-contract",
      "argv": [
        "python3",
        "scripts/validate-affected-surfaces.py",
        "--root",
        "."
      ],
      "lanes": [
        "affected",
        "staged"
      ],
      "optional": false,
      "fallback": {
        "status": "FAIL",
        "reason": "Affected-surface registry validation is required."
      },
      "evidenceLane": "repo-static"
    },
    {
      "id": "agent-governance",
      "argv": [
        "python3",
        "scripts/validate-agent-governance.py",
        "--root",
        "."
      ],
      "lanes": [
        "affected",
        "staged"
      ],
      "optional": false,
      "fallback": {
        "status": "FAIL",
        "reason": "Canonical agent registry, native adapter, and consumer validation is required."
      },
      "evidenceLane": "repo-static"
    },
    {
      "id": "archive-contract-tests",
      "argv": [
        "python3",
        "scripts/run-contract-tests.py",
        "--root",
        ".",
        "--suite",
        "archive"
      ],
      "lanes": [
        "affected",
        "staged"
      ],
      "optional": false,
      "fallback": {
        "status": "FAIL",
        "reason": "Stage 98 archive contract regressions are required."
      },
      "evidenceLane": "repo-static"
    },
    {
      "id": "archive-integrity",
      "argv": [
        "python3",
        "scripts/validate-archive-integrity.py",
        "--root",
        "."
      ],
      "lanes": [
        "affected",
        "staged"
      ],
      "optional": false,
      "fallback": {
        "status": "FAIL",
        "reason": "Current Stage 98 archive integrity and secret validation is required."
      },
      "evidenceLane": "repo-static"
    },
    {
      "id": "workspace-memory-regressions",
      "argv": [
        "python3",
        "tests/test_workspace_memory.py"
      ],
      "lanes": [
        "affected",
        "staged"
      ],
      "optional": false,
      "fallback": {
        "status": "FAIL",
        "reason": "Workspace memory behavior regressions are required."
      },
      "evidenceLane": "repo-static"
    },
    {
      "id": "git-hook-chain-regressions",
      "argv": [
        "python3",
        "tests/test_chained_git_hooks.py"
      ],
      "lanes": [
        "affected",
        "staged"
      ],
      "optional": false,
      "fallback": {
        "status": "FAIL",
        "reason": "Git hook chain behavior regressions are required."
      },
      "evidenceLane": "repo-static"
    },
    {
      "id": "ci-python-contract",
      "argv": [
        "python3",
        "scripts/validate-ci-python-contract.py",
        "--root",
        "."
      ],
      "lanes": [
        "affected",
        "staged"
      ],
      "optional": false,
      "fallback": {
        "status": "FAIL",
        "reason": "CI Python dependency validation is required."
      },
      "evidenceLane": "repo-static"
    },
    {
      "id": "document-contract-registry",
      "reuse": {
        "mode": "change-scoped"
      },
      "argv": [
        "python3",
        "scripts/validate-document-contract-registry.py",
        "--root",
        ".",
        "--mode",
        "strict"
      ],
      "pathInput": "include-existing-markdown",
      "lanes": [
        "affected",
        "staged"
      ],
      "optional": false,
      "fallback": {
        "status": "FAIL",
        "reason": "Document path classification is required."
      },
      "evidenceLane": "repo-static"
    },
    {
      "id": "document-contract-tests",
      "argv": [
        "python3",
        "scripts/run-contract-tests.py",
        "--root",
        ".",
        "--suite",
        "document"
      ],
      "lanes": [
        "affected",
        "staged"
      ],
      "optional": false,
      "timeoutSeconds": 900,
      "fallback": {
        "status": "FAIL",
        "reason": "Document lifecycle contract regressions are required."
      },
      "evidenceLane": "repo-static"
    },
    {
      "id": "archive-validation-tests",
      "argv": [
        "python3",
        "scripts/run-contract-tests.py",
        "--root",
        ".",
        "--suite",
        "archive-validation"
      ],
      "lanes": [
        "affected",
        "staged"
      ],
      "optional": false,
      "fallback": {
        "status": "FAIL",
        "reason": "Archive validator regressions are required."
      },
      "evidenceLane": "repo-static"
    },
    {
      "id": "document-lifecycle-tests",
      "argv": [
        "python3",
        "scripts/run-contract-tests.py",
        "--root",
        ".",
        "--suite",
        "document-lifecycle"
      ],
      "lanes": [
        "affected",
        "staged"
      ],
      "optional": false,
      "fallback": {
        "status": "FAIL",
        "reason": "Document lifecycle migration and identity regressions are required."
      },
      "evidenceLane": "repo-static"
    },
    {
      "id": "validation-routing-tests",
      "argv": [
        "python3",
        "scripts/run-contract-tests.py",
        "--root",
        ".",
        "--suite",
        "validation-routing"
      ],
      "lanes": [
        "affected",
        "staged"
      ],
      "optional": false,
      "fallback": {
        "status": "FAIL",
        "reason": "Validation routing and lane runner regressions are required."
      },
      "evidenceLane": "repo-static"
    },
    {
      "id": "qa-runner-tests",
      "argv": [
        "python3",
        "scripts/run-contract-tests.py",
        "--root",
        ".",
        "--suite",
        "qa-runner"
      ],
      "lanes": [
        "affected",
        "staged"
      ],
      "optional": false,
      "fallback": {
        "status": "FAIL",
        "reason": "QA runner regressions are required."
      },
      "evidenceLane": "repo-static"
    },
    {
      "id": "ci-metadata-tests",
      "argv": [
        "python3",
        "scripts/run-contract-tests.py",
        "--root",
        ".",
        "--suite",
        "ci-metadata"
      ],
      "lanes": [
        "affected",
        "staged"
      ],
      "optional": false,
      "fallback": {
        "status": "FAIL",
        "reason": "CI metadata and actions security regressions are required."
      },
      "evidenceLane": "repo-static"
    },
    {
      "id": "release-tests",
      "argv": [
        "python3",
        "scripts/run-contract-tests.py",
        "--root",
        ".",
        "--suite",
        "release"
      ],
      "lanes": [
        "affected",
        "staged"
      ],
      "optional": false,
      "fallback": {
        "status": "FAIL",
        "reason": "Release and commit contract regressions are required."
      },
      "evidenceLane": "repo-static"
    },
    {
      "id": "agent-governance-tests",
      "argv": [
        "python3",
        "scripts/run-contract-tests.py",
        "--root",
        ".",
        "--suite",
        "agent-governance"
      ],
      "lanes": [
        "affected",
        "staged"
      ],
      "optional": false,
      "fallback": {
        "status": "FAIL",
        "reason": "Agent governance regressions are required."
      },
      "evidenceLane": "repo-static"
    },
    {
      "id": "tooling-tests",
      "argv": [
        "python3",
        "scripts/run-contract-tests.py",
        "--root",
        ".",
        "--suite",
        "tooling"
      ],
      "lanes": [
        "affected",
        "staged"
      ],
      "optional": false,
      "fallback": {
        "status": "FAIL",
        "reason": "Repository tooling regressions are required."
      },
      "evidenceLane": "repo-static"
    },
    {
      "id": "cluster-gate-tests",
      "argv": [
        "python3",
        "scripts/run-contract-tests.py",
        "--root",
        ".",
        "--suite",
        "cluster-gate"
      ],
      "lanes": [
        "affected",
        "staged"
      ],
      "optional": false,
      "fallback": {
        "status": "FAIL",
        "reason": "Cluster gate script regressions are required."
      },
      "evidenceLane": "repo-static"
    },
    {
      "id": "document-lifecycle",
      "argv": [
        "python3",
        "scripts/validate-document-lifecycle.py",
        "--root",
        ".",
        "--mode",
        "strict"
      ],
      "lanes": [
        "affected",
        "staged"
      ],
      "optional": false,
      "fallback": {
        "status": "FAIL",
        "reason": "Document lifecycle validation is required."
      },
      "evidenceLane": "repo-static"
    },
    {
      "id": "github-actions-security",
      "argv": [
        "python3",
        "scripts/validate-github-actions-security.py",
        "--root",
        "."
      ],
      "lanes": [
        "affected",
        "staged"
      ],
      "optional": false,
      "fallback": {
        "status": "FAIL",
        "reason": "GitHub Actions pinned identity, least-privilege permissions, and workflow structure validation is required."
      },
      "evidenceLane": "repo-static"
    },
    {
      "id": "gitops-change-set",
      "argv": [
        "python3",
        "scripts/validate-gitops-change-set.py",
        "--root",
        ".",
        "--base-ref",
        "HEAD"
      ],
      "lanes": [
        "affected",
        "staged"
      ],
      "optional": false,
      "fallback": {
        "status": "FAIL",
        "reason": "Identity-only GitOps change-set review is required."
      },
      "evidenceLane": "repo-static"
    },
    {